{
  "schema_version": 1,
  "preset": "baseline-release",
  "authorization": "review-only",
  "consulted_routers": ["review-graph", "rust-review-orchestrator", "python-review-orchestrator", "docs-review-orchestrator"],
  "instruction_paths": [],
  "execution_profile": "grouped",
  "environment": "current POSIX host; existing locked repository environment",
  "toolchain": "repository-pinned tools and Just",
  "platform": "current native host",
  "features": [],
  "elapsed_time_budget": "30m",
  "artifact_root": "/tmp/review-proof/validation",
  "ignored_outputs": [
    {"path": ".venv", "kind": "build"},
    {"path": ".pytest_cache", "kind": "cache"},
    {"path": ".ruff_cache", "kind": "cache"}
  ],
  "external_artifacts": [],
  "command_policy": {
    "disposition": "blocked",
    "reason": "Inspect just ci, nested recipes, outputs and task restrictions before allowing this exact gate."
  },
  "execution_prerequisites": {
    "sandbox_permissions": "use_default",
    "executables": ["env", "just", "uv"],
    "uv_projects": [{"project_directory": ".", "environment_path": ".venv", "executables": ["python", "pytest"]}],
    "native_available": false,
    "reason": "Confirm native prerequisites and adapt tools, caches and ignored outputs to the inspected repository."
  }
}
